{
  "arn": "arn:aws:service:us-east-1:123456789012:resource/example",
  "status": "ACTIVE",
  "createdAt": "example-value",
  "failureCode": "example-value",
  "failureReason": "example-value",
  "clientRequestToken": "example-value",
  "template": "example-value",
  "worldCount": "example-value",
  "finishedWorldsSummary": "example-value",
  "tags": "example-value"
}